{
  "$schema": "https://json-schema.org/draft/2020-12/schema",
  "$id": "https://patchmesh.dev/schemas/phase0/v1/finding.schema.json",
  "type": "object", "properties": {
    "findingId": { "type": "string", "pattern": "^finding_[0-9a-f]{32}$" }, "findingType": { "enum": ["same_symbol_overlap", "stale_read_before_write", "exported_contract_invalidation"] }, "status": { "enum": ["open", "dismissed", "resolved"] }, "subjectResourceId": { "$ref": "./identities.schema.json#/$defs/resourceId" }, "affectedTaskId": { "$ref": "./identities.schema.json#/$defs/taskId" }, "dependencyIds": { "type": "array", "items": { "type": "string", "pattern": "^dep_[0-9a-f]{32}$" }, "uniqueItems": true }, "evidenceEventIds": { "type": "array", "items": { "$ref": "./identities.schema.json#/$defs/eventId" }, "minItems": 1, "uniqueItems": true }, "confidence": { "type": "number", "minimum": 0 }, "confidenceBand": { "enum": ["low", "medium", "high"] }, "severity": { "enum": ["info", "warning", "critical"] }, "coverageIds": { "type": "array", "items": { "$ref": "./coverage.schema.json#/$defs/coverageId" }, "minItems": 1, "uniqueItems": true }, "detector": { "type": "object", "properties": { "detectorId": { "type": "string", "pattern": "^detector_[a-z0-9][a-z0-9._-]{0,63}$" }, "version": { "type": "string", "pattern": "^\\S+$" } }, "required": ["detectorId", "version"], "additionalProperties": false }
  }, "required": ["findingId", "findingType", "status", "subjectResourceId", "affectedTaskId", "dependencyIds", "evidenceEventIds", "confidence", "confidenceBand", "severity", "coverageIds", "detector"], "additionalProperties": false
}
